{
 "catalog": {
  "fingerprint": "a7180288f0c54b70a8009e6efcda730aec648e88ad9b8d148a51641664b8df81",
  "version": "0.7.0"
 },
 "cells": [
  {
   "approved": null,
   "binding": null,
   "bindings_file": {
    "catalog_fingerprint": "a7180288f0c54b70a8009e6efcda730aec648e88ad9b8d148a51641664b8df81",
    "catalog_version": "0.7.0",
    "generated_at": "2026-09-20T06:00:50+00:00",
    "generated_from": "6edecaa86ededcf083f91ac9c43265e27853c59b",
    "product_version": "1.18",
    "sha256": "5ce51592aa37daa23555f33bf5e430df2ba66c6412ac30ec54e3eb3b7a8cf8f2"
   },
   "kind": "kotlin_metric",
   "product": "CDPM",
   "record_id": "credit_hours_spread",
   "section": "criteria",
   "stand": null,
   "state": "нет"
  },
  {
   "approved": null,
   "binding": {
    "cr_key": null,
    "file": "kotlin-solver/src/main/kotlin/org/acme/flighcrewscheduling/solver/TaskModes.kt",
    "note": null,
    "state": "есть",
    "symbol": "METRIC_EXECUTORS"
   },
   "bindings_file": {
    "catalog_fingerprint": "a7180288f0c54b70a8009e6efcda730aec648e88ad9b8d148a51641664b8df81",
    "catalog_version": "0.7.0",
    "generated_at": "2026-09-20T06:00:50+00:00",
    "generated_from": "6edecaa86ededcf083f91ac9c43265e27853c59b",
    "product_version": "1.18.5",
    "sha256": "58edae9a2edf2451ab98d301f9d79a49532513c87dbc53223afd97af9735017c"
   },
   "kind": "kotlin_metric",
   "product": "COSMOS",
   "record_id": "credit_hours_spread",
   "section": "criteria",
   "stand": null,
   "state": "не проверено"
  },
  {
   "approved": null,
   "binding": null,
   "bindings_file": {
    "catalog_fingerprint": "a7180288f0c54b70a8009e6efcda730aec648e88ad9b8d148a51641664b8df81",
    "catalog_version": "0.7.0",
    "generated_at": "2026-09-20T06:00:50+00:00",
    "generated_from": "6edecaa86ededcf083f91ac9c43265e27853c59b",
    "product_version": "1.18",
    "sha256": "5ce51592aa37daa23555f33bf5e430df2ba66c6412ac30ec54e3eb3b7a8cf8f2"
   },
   "kind": "kotlin_metric",
   "product": "CDPM",
   "record_id": "layover_nights_total",
   "section": "criteria",
   "stand": null,
   "state": "нет"
  },
  {
   "approved": null,
   "binding": {
    "cr_key": null,
    "file": "kotlin-solver/src/main/kotlin/org/acme/flighcrewscheduling/solver/TaskModes.kt",
    "note": null,
    "state": "есть",
    "symbol": "METRIC_EXECUTORS"
   },
   "bindings_file": {
    "catalog_fingerprint": "a7180288f0c54b70a8009e6efcda730aec648e88ad9b8d148a51641664b8df81",
    "catalog_version": "0.7.0",
    "generated_at": "2026-09-20T06:00:50+00:00",
    "generated_from": "6edecaa86ededcf083f91ac9c43265e27853c59b",
    "product_version": "1.18.5",
    "sha256": "58edae9a2edf2451ab98d301f9d79a49532513c87dbc53223afd97af9735017c"
   },
   "kind": "kotlin_metric",
   "product": "COSMOS",
   "record_id": "layover_nights_total",
   "section": "criteria",
   "stand": null,
   "state": "не проверено"
  },
  {
   "approved": null,
   "binding": null,
   "bindings_file": {
    "catalog_fingerprint": "a7180288f0c54b70a8009e6efcda730aec648e88ad9b8d148a51641664b8df81",
    "catalog_version": "0.7.0",
    "generated_at": "2026-09-20T06:00:50+00:00",
    "generated_from": "6edecaa86ededcf083f91ac9c43265e27853c59b",
    "product_version": "1.18",
    "sha256": "5ce51592aa37daa23555f33bf5e430df2ba66c6412ac30ec54e3eb3b7a8cf8f2"
   },
   "kind": "builder_method",
   "product": "CDPM",
   "record_id": "min_person_days",
   "section": "criteria",
   "stand": null,
   "state": "нет"
  },
  {
   "approved": {
    "at": "2026-09-20",
    "by": "владелец",
    "how": "выпуск 0.7.0, предпроверка 10"
   },
   "binding": {
    "cr_key": null,
    "file": "vmp/criteria.py",
    "note": "счёт — Builder.span_days в ветке весов Builder.price, ключ --w-span-day",
    "state": "есть",
    "symbol": "_exec_min_person_days"
   },
   "bindings_file": {
    "catalog_fingerprint": "a7180288f0c54b70a8009e6efcda730aec648e88ad9b8d148a51641664b8df81",
    "catalog_version": "0.7.0",
    "generated_at": "2026-09-20T06:00:50+00:00",
    "generated_from": "6edecaa86ededcf083f91ac9c43265e27853c59b",
    "product_version": "1.18.5",
    "sha256": "58edae9a2edf2451ab98d301f9d79a49532513c87dbc53223afd97af9735017c"
   },
   "kind": "builder_method",
   "product": "COSMOS",
   "record_id": "min_person_days",
   "section": "criteria",
   "stand": {
    "at": "2026-09-20T06:00:50+00:00",
    "commit": "6edecaa86ededcf083f91ac9c43265e27853c59b",
    "failed": 0,
    "passed": 1,
    "skipped": 0,
    "tasks": [
     "st-mpd-1"
    ]
   },
   "state": "есть"
  },
  {
   "approved": null,
   "binding": null,
   "bindings_file": {
    "catalog_fingerprint": "a7180288f0c54b70a8009e6efcda730aec648e88ad9b8d148a51641664b8df81",
    "catalog_version": "0.7.0",
    "generated_at": "2026-09-20T06:00:50+00:00",
    "generated_from": "6edecaa86ededcf083f91ac9c43265e27853c59b",
    "product_version": "1.18",
    "sha256": "5ce51592aa37daa23555f33bf5e430df2ba66c6412ac30ec54e3eb3b7a8cf8f2"
   },
   "kind": "kotlin_metric",
   "product": "CDPM",
   "record_id": "positioning_cost",
   "section": "criteria",
   "stand": null,
   "state": "нет"
  },
  {
   "approved": null,
   "binding": {
    "cr_key": null,
    "file": "kotlin-solver/src/main/kotlin/org/acme/flighcrewscheduling/solver/TaskModes.kt",
    "note": null,
    "state": "есть",
    "symbol": "METRIC_EXECUTORS"
   },
   "bindings_file": {
    "catalog_fingerprint": "a7180288f0c54b70a8009e6efcda730aec648e88ad9b8d148a51641664b8df81",
    "catalog_version": "0.7.0",
    "generated_at": "2026-09-20T06:00:50+00:00",
    "generated_from": "6edecaa86ededcf083f91ac9c43265e27853c59b",
    "product_version": "1.18.5",
    "sha256": "58edae9a2edf2451ab98d301f9d79a49532513c87dbc53223afd97af9735017c"
   },
   "kind": "kotlin_metric",
   "product": "COSMOS",
   "record_id": "positioning_cost",
   "section": "criteria",
   "stand": null,
   "state": "не проверено"
  },
  {
   "approved": null,
   "binding": null,
   "bindings_file": {
    "catalog_fingerprint": "a7180288f0c54b70a8009e6efcda730aec648e88ad9b8d148a51641664b8df81",
    "catalog_version": "0.7.0",
    "generated_at": "2026-09-20T06:00:50+00:00",
    "generated_from": "6edecaa86ededcf083f91ac9c43265e27853c59b",
    "product_version": "1.18",
    "sha256": "5ce51592aa37daa23555f33bf5e430df2ba66c6412ac30ec54e3eb3b7a8cf8f2"
   },
   "kind": "kotlin_metric",
   "product": "CDPM",
   "record_id": "preferred_days_off_violations",
   "section": "criteria",
   "stand": null,
   "state": "нет"
  },
  {
   "approved": null,
   "binding": {
    "cr_key": null,
    "file": "kotlin-solver/src/main/kotlin/org/acme/flighcrewscheduling/solver/TaskModes.kt",
    "note": null,
    "state": "есть",
    "symbol": "METRIC_EXECUTORS"
   },
   "bindings_file": {
    "catalog_fingerprint": "a7180288f0c54b70a8009e6efcda730aec648e88ad9b8d148a51641664b8df81",
    "catalog_version": "0.7.0",
    "generated_at": "2026-09-20T06:00:50+00:00",
    "generated_from": "6edecaa86ededcf083f91ac9c43265e27853c59b",
    "product_version": "1.18.5",
    "sha256": "58edae9a2edf2451ab98d301f9d79a49532513c87dbc53223afd97af9735017c"
   },
   "kind": "kotlin_metric",
   "product": "COSMOS",
   "record_id": "preferred_days_off_violations",
   "section": "criteria",
   "stand": null,
   "state": "не проверено"
  },
  {
   "approved": null,
   "binding": null,
   "bindings_file": {
    "catalog_fingerprint": "a7180288f0c54b70a8009e6efcda730aec648e88ad9b8d148a51641664b8df81",
    "catalog_version": "0.7.0",
    "generated_at": "2026-09-20T06:00:50+00:00",
    "generated_from": "6edecaa86ededcf083f91ac9c43265e27853c59b",
    "product_version": "1.18",
    "sha256": "5ce51592aa37daa23555f33bf5e430df2ba66c6412ac30ec54e3eb3b7a8cf8f2"
   },
   "kind": "builder_method",
   "product": "CDPM",
   "record_id": "rank_normalized_cost",
   "section": "criteria",
   "stand": null,
   "state": "нет"
  },
  {
   "approved": {
    "at": "2026-09-20",
    "by": "владелец",
    "how": "выпуск 0.7.0, предпроверка 10"
   },
   "binding": {
    "cr_key": null,
    "file": "vmp/criteria.py",
    "note": "счёт — Builder.cost_0096; исполнитель сверяет контрольную пару файла контура (vmp-criterion-control-pairs.json): путь в него не передаётся, файла нет — исход «silent»; у стенда свой файл пары, его сверяет судья той же check_control_pair",
    "state": "есть",
    "symbol": "_exec_rank_normalized_cost"
   },
   "bindings_file": {
    "catalog_fingerprint": "a7180288f0c54b70a8009e6efcda730aec648e88ad9b8d148a51641664b8df81",
    "catalog_version": "0.7.0",
    "generated_at": "2026-09-20T06:00:50+00:00",
    "generated_from": "6edecaa86ededcf083f91ac9c43265e27853c59b",
    "product_version": "1.18.5",
    "sha256": "58edae9a2edf2451ab98d301f9d79a49532513c87dbc53223afd97af9735017c"
   },
   "kind": "builder_method",
   "product": "COSMOS",
   "record_id": "rank_normalized_cost",
   "section": "criteria",
   "stand": {
    "at": "2026-09-20T06:00:50+00:00",
    "commit": "6edecaa86ededcf083f91ac9c43265e27853c59b",
    "failed": 0,
    "passed": 1,
    "skipped": 0,
    "tasks": [
     "st-rnc-1"
    ]
   },
   "state": "есть"
  },
  {
   "approved": null,
   "binding": null,
   "bindings_file": {
    "catalog_fingerprint": "a7180288f0c54b70a8009e6efcda730aec648e88ad9b8d148a51641664b8df81",
    "catalog_version": "0.7.0",
    "generated_at": "2026-09-20T06:00:50+00:00",
    "generated_from": "6edecaa86ededcf083f91ac9c43265e27853c59b",
    "product_version": "1.18",
    "sha256": "5ce51592aa37daa23555f33bf5e430df2ba66c6412ac30ec54e3eb3b7a8cf8f2"
   },
   "kind": "builder_method",
   "product": "CDPM",
   "record_id": "total_pairing_cost",
   "section": "criteria",
   "stand": null,
   "state": "нет"
  },
  {
   "approved": {
    "at": "2026-09-20",
    "by": "владелец",
    "how": "выпуск 0.7.0, предпроверка 10"
   },
   "binding": {
    "cr_key": null,
    "file": "_pairing_builder.py",
    "note": "композиция целевой пейринга: критерий блока criterion пакета плюс сумма мера×вес×состав; движок отбора — _select_engines.solve",